{
  "id": "independence-narrative-demo",
  "title": "Timeline drives visual focus (composition smoke test)",
  "engines": [
    {
      "instanceId": "timeline-independence",
      "engine": "timeline",
      "spec": {
        "type": "timeline",
        "version": "1.0.0",
        "id": "timeline-independence",
        "metadata": {
          "title": "Indian independence — key events"
        },
        "content": {
          "kind": "events",
          "events": [
            {
              "id": "event-1857",
              "label": "1857 uprising",
              "date": "1857"
            },
            {
              "id": "event-1947",
              "label": "Independence",
              "date": "1947-08-15",
              "links": {
                "visualEntityId": "figure-independence"
              }
            }
          ]
        },
        "interaction": {
          "mode": "explore",
          "actions": ["select", "focus", "play-pause", "step", "reset"]
        },
        "sources": [
          {
            "class": "authoritative"
          }
        ],
        "accessibility": {
          "label": "Timeline of Indian independence"
        },
        "questions": []
      }
    },
    {
      "instanceId": "visual-independence",
      "engine": "visual",
      "spec": {
        "type": "visual",
        "version": "1.0.0",
        "id": "visual-independence",
        "content": {
          "kind": "illustration",
          "entities": [
            {
              "id": "figure-independence",
              "label": "Independence celebration"
            }
          ]
        },
        "interaction": {
          "mode": "explore",
          "actions": ["focus", "select", "reset"]
        },
        "accessibility": {
          "label": "Historical illustration for selected timeline event"
        },
        "questions": []
      }
    }
  ],
  "bindings": [
    {
      "on": "timeline.event-selected",
      "from": "timeline-independence",
      "dispatch": {
        "to": "visual-independence",
        "action": "focus",
        "targetIdFrom": "links.visualEntityId"
      }
    }
  ]
}